{
  "id": "0191f7a0-6c3e-7b2a-9f00-1234567890ab",
  "type": "payment.posted",
  "version": 1,
  "occurredAt": "2026-09-08T10:15:30Z",
  "businessDate": "2026-09-08",
  "producer": "core-api",
  "aggregateType": "Payment",
  "aggregateId": "0191f7a0-5b1d-7c3e-8a00-abcdefabcdef",
  "correlationId": "0191f7a0-4a0c-7d4f-9b00-fedcbafedcba",
  "causationId": null,
  "payload": {
    "paymentId": "0191f7a0-5b1d-7c3e-8a00-abcdefabcdef",
    "kind": "EXTERNAL_OUT",
    "debtorAccountId": "0191f7a0-1111-7000-8000-000000000001",
    "debtorIban": "PL61100000000000000000000001",
    "creditorIban": "PL27114020040000300201355387",
    "creditorName": "Jan Kowalski",
    "amount": { "minor": 12345, "currency": "PLN" },
    "title": "Faktura 12/2026",
    "businessDate": "2026-09-08",
    "external": true
  }
}
