{
  "id": "0191f7a0-6c3e-7b2a-9f00-1234567890ab",
  "type": "customer.created",
  "version": 1,
  "occurredAt": "2026-09-08T10:15:30Z",
  "businessDate": "2026-09-08",
  "producer": "core-api",
  "aggregateType": "Customer",
  "aggregateId": "0191f7a0-0001-7000-8000-000000000001",
  "correlationId": "0191f7a0-4a0c-7d4f-9b00-fedcbafedcba",
  "causationId": null,
  "payload": {
    "customerId": "0191f7a0-0001-7000-8000-000000000001",
    "email": "jan.kowalski@example.com",
    "fullName": "Jan Kowalski"
  }
}
