{
  "id": "0191f7a0-6c3e-7b2a-9f00-1234567890ab",
  "type": "clearing.incoming_received",
  "version": 1,
  "occurredAt": "2026-09-08T10:15:30Z",
  "businessDate": "2026-09-08",
  "producer": "clearing-sim",
  "aggregateType": "IncomingTransfer",
  "aggregateId": "CLR-2026-000123",
  "correlationId": "0191f7a0-4a0c-7d4f-9b00-fedcbafedcba",
  "causationId": null,
  "payload": {
    "clearingRef": "CLR-2026-000123",
    "debtorIban": "PL61100000000000000000000001",
    "debtorName": "Firma Alfa sp. z o.o.",
    "creditorIban": "PL27114020040000300201355387",
    "amount": {
      "minor": 12345,
      "currency": "PLN"
    },
    "title": "Faktura 12/2026",
    "valueDate": "2026-09-08"
  }
}
