{
  "id": "0191f7a0-6c3e-7b2a-9f00-1234567890ab",
  "type": "payment.incoming_credited",
  "version": 1,
  "occurredAt": "2026-09-08T10:15:30Z",
  "businessDate": "2026-09-08",
  "producer": "core-api",
  "aggregateType": "Payment",
  "aggregateId": "0191f7a0-5b1d-7c3e-8a00-abcdefabcdef",
  "correlationId": "0191f7a0-4a0c-7d4f-9b00-fedcbafedcba",
  "causationId": "0191f7a0-6c3e-7b2a-9f00-000000000001",
  "payload": {
    "paymentId": "0191f7a0-5b1d-7c3e-8a00-abcdefabcdef",
    "creditorAccountId": "0191f7a0-1111-7000-8000-000000000002",
    "amount": {
      "minor": 12345,
      "currency": "PLN"
    },
    "debtorName": "Firma Alfa sp. z o.o.",
    "debtorIban": "PL61100000000000000000000001",
    "title": "Faktura 12/2026",
    "customerId": "0191f7a0-0001-7000-8000-000000000001",
    "email": "jan.kowalski@example.com",
    "creditorIban": "PL27114020040000300201355387",
    "reference": "PAY-20260908-7K3M2Q"
  }
}
