{
  "id": "0191f7a0-6c3e-7b2a-9f00-1234567890ab",
  "type": "clearing.returned",
  "version": 1,
  "occurredAt": "2026-09-08T10:15:30Z",
  "businessDate": "2026-09-08",
  "producer": "clearing-sim",
  "aggregateType": "Payment",
  "aggregateId": "0191f7a0-5b1d-7c3e-8a00-abcdefabcdef",
  "correlationId": "0191f7a0-4a0c-7d4f-9b00-fedcbafedcba",
  "causationId": null,
  "payload": {
    "clearingRef": "CLR-2026-000123",
    "paymentId": "0191f7a0-5b1d-7c3e-8a00-abcdefabcdef",
    "reasonCode": "AC01"
  }
}
